{
  "version": "1.0.0",
  "currentTaskId": null,
  "currentSubtaskPath": null,
  "currentStep": "starting",
  "mode": "interactive",
  "startedAt": "1970-01-01T00:00:00Z",
  "lastUpdate": "1970-01-01T00:00:00Z",
  "loop": {
    "iteration": 0,
    "maxIterations": 20
  },
  "contextSnapshot": {
    "tasksVersion": "1.0.0",
    "tasksFileHash": "",
    "promptHash": "",
    "notes": "Freshly initialized."
  },
  "evidence": {
    "filesCreated": [],
    "filesModified": [],
    "commitSha": null,
    "testsPassingBefore": 0,
    "testsPassingAfter": 0
  },
  "verificationsPassed": {
    "filesCreated": false,
    "filesNonEmpty": false,
    "gitChangesExist": false,
    "testsPass": false,
    "committed": false
  },
  "lastDecision": {
    "summary": "Initialized state.json",
    "timestamp": "1970-01-01T00:00:00Z"
  },
  "taskMemory": [],
  "appliedMemories": [],
  "logging": {
    "debugEnabled": false,
    "sessionId": null
  }
}